<!--
  ~ The MIT License (MIT)
  ~
  ~ Copyright (c) 2007-2015 Broad Institute
  ~
  ~ Permission is hereby granted, free of charge, to any person obtaining a copy
  ~ of this software and associated documentation files (the "Software"), to deal
  ~ in the Software without restriction, including without limitation the rights
  ~ to use, copy, modify, merge, publish, distribute, sublicense, and/or sell
  ~ copies of the Software, and to permit persons to whom the Software is
  ~ furnished to do so, subject to the following conditions:
  ~
  ~ The above copyright notice and this permission notice shall be included in
  ~ all copies or substantial portions of the Software.
  ~
  ~
  ~ THE SOFTWARE IS PROVIDED "AS IS", WITHOUT WARRANTY OF ANY KIND, EXPRESS OR
  ~ IMPLIED, INCLUDING BUT NOT LIMITED TO THE WARRANTIES OF MERCHANTABILITY,
  ~ FITNESS FOR A PARTICULAR PURPOSE AND NONINFRINGEMENT. IN NO EVENT SHALL THE
  ~ AUTHORS OR COPYRIGHT HOLDERS BE LIABLE FOR ANY CLAIM, DAMAGES OR OTHER
  ~ LIABILITY, WHETHER IN AN ACTION OF CONTRACT, TORT OR OTHERWISE, ARISING FROM,
  ~ OUT OF OR IN CONNECTION WITH THE SOFTWARE OR THE USE OR OTHER DEALINGS IN
  ~ THE SOFTWARE.
  -->

<!DOCTYPE cli_plugin SYSTEM "cli_plugin.dtd">
<cli_plugin api_version="alpha" plugin_version="0.1" name="GATK"
            id="org.broad.igv.plugin.gatk">
    <tool name="GATK" defaultPath="GenomeAnalysisTK.jar" visible="false"
          helpUrl="http://www.broadinstitute.org/gatk/gatkdocs/" toolUrl="http://www.broadinstitute.org/gatk/">

        <msg>java</msg>
        <msg>-jar</msg>

        <command name="Unified Genotyper" cmd="-T UnifiedGenotyper">
            <arg name="Reference Sequence" id="refseq" cmd_arg="-R" type="LONGTEXT" remembered="true"/>
            <arg name="Track" cmd_arg="-I" id="track" type="ALIGNMENT_TRACK"/>
            <arg name="Intervals" cmd_arg="-L" id="intervals" type="LOCUS" visible="false"/>
            <arg name="Output File" cmd_arg="-o" id="out" type="LONGTEXT" defaultValue="out.vcf"/>
            <output name="Variants Track" defaultValue="Variants">
                <parser source="$out" format="vcf"/>
            </output>
        </command>

    </tool>
</cli_plugin>